{
  "protocol": "spartan-gaming/1",
  "messageId": "msg-01HXYZ123456",
  "sessionId": "ses-01HXYZ123456",
  "type": "session.offer",
  "sentAt": "2026-08-07T12:00:00Z",
  "sequence": 0,
  "payload": {
    "role": "client",
    "transports": ["webrtc"],
    "video": {
      "codecs": ["av1", "vp9", "h264"],
      "maxWidth": 3840,
      "maxHeight": 2160,
      "maxFramerate": 144,
      "hdr": false
    },
    "audio": {
      "codecs": ["opus"],
      "channels": 2
    },
    "input": {
      "gamepad": true,
      "keyboard": true,
      "pointer": true,
      "rumble": true
    }
  }
}

